sentences	score
"To manifest money using the law of attraction , each day practice thinking more thoughts of abundance than of lack of money ."	1
"The key to success is your thoughts and feelings , and you have been holding the key in your hand all of your life ."	0
"You cannot miss an opportunity , because the Universe has UNLIMITED opportunities to present to you . You will seize the right one ."	0
What you think and what you feel and what actually manifests is ALWAYS a match - no exception .	1
Victory is in sight when you begin to catch your negative words mid-stream . It means you’re becoming more conscious and aware !	0
Today decide to attract only the best !	0
"The life of your dreams starts with one powerful thought , and then another , and another ."	0
Your imagination is your tool of creation from the Universe .	1
Your mind has the power to change all of the outer aspects of your life . You create your life from the inside out .	0
"There is no "" other person "" for the law of attraction . What you give out to others , you give to yourself ."	0
You must focus on abundance to bring more abundance to you .	1
"Change the person in the mirror , and your world will change ."	0
Your predominant thoughts and feelings today are creating a frequency that is automatically determining your life tomorrow .	1
"Remember , YOU are the most powerful magnet in the Universe ."	0
Feel really good about YOU and you will attract more circumstances and events that will make you feel good about you .	0
"When you ask and believe , you are getting yourself out of the way so the Universe can do its work ."	0
It's your choice - YOU attract what YOU put out there . What are you putting out there NOW ?	0
Let go of anything that you don’t love about your life story and just keep the things you love !	0
"You are free to think thoughts of worry , or thoughts of joy . Whatever you choose will attract the same back to you . I recommend joy !"	0
Your destiny is in Your hands . Whatever you think and feel will decide your life .	1
Something better is coming . . . you're allowed to be excited !	0
"When you fall in love with life , you have no resistance , and whatever you love appears in your life almost instantaneously ."	1
"When we lighten up , instantaneously we change our future and we make it brighter ."	0
Remember that you are a magnet . Appreciation attracts appreciation .	1
Think about what you would do if you had your desire & take creative actions that make it clear you are receiving NOW .	0
"Want to ramp up the good things in life ? Compliment other people . Live , think and breathe appreciation & gratitude ."	0
Every single circumstance of your life can change .	0
"When change comes , relax , have total faith and know that the change is ALL GOOD . Something more magnificent is coming ."	0
The universe gives you what you focus on .	1
Trust your instincts . It's the universe inspiring you .	1
Thoughts Become Things .	1
"Practice tuning yourself to the harmony of the Universe . Good thoughts , good words , good actions ."	1
Notice what you are speaking about . Energy flows where attention goes .	1
"Focus on the outcome , and let the Universe do its thing ."	0
Trust in the Universe when there is a change in your life . Change means something greater is coming !	0
Watch your words each day and make all of your words fit with what you want ! (not what you don’t want) .	0
The power within each of us is unfathomable when focused in the direction of all good for all .	0
"Begin your day by feeling grateful . Be grateful for the bed you just slept in , the roof over your head , keep going . . ."	0
You create your life with your thoughts . Your mind is shaping the world around you .	0
It is wonderful when you begin to catch your unwanted words mid-stream . It means you’re becoming more conscious and aware .	0
There is no such thing as a hopeless situation . Every single circumstance in your life can change .	0
Your feelings are the power of your thoughts and words . The law of attraction will receive those grateful thoughts and give you more just like them .	1
"As you imagine the worst , that is what you will receive back . As you imagine the best that is what you will experience ."	1
"To change your world , all you have to do is manage your thoughts and feelings on the inside of you . Then your whole world changes ."	0
Within you are the answers you need to every single question . Ask the question and then wait - the perfect answer will come to you .	0
"Give the best of you everywhere you go . Give a smile , give thanks , give kindness , give love & give without expectation of return ."	0
"If you want to change anything in your life , change the frequency by changing your thoughts ."	1
"You get to choose what you want , but you must get clear about what you want . This is your work ."	0
"Beliefs about aging are all in our minds , so release those thoughts from your consciousness . Focus on health & youth ."	0
"Whenever you say "" I am "" the words that follow are summoning creation with a mighty force . Make sure whatever comes after "" I am "" is positive ."	1
"One way or another , your beliefs become your reality ."	0
"Everything is going to be ok in the end . If it's not ok , it's not the end ."	0
"Never let a day pass without looking for the good , praising , appreciating , blessing and being grateful ."	0
"You are the one who lines things up for you , so dwell on what you want ."	0
"You can turn your life into paradise , but the only way you can do it is to make the inside of you a paradise ."	0
Don't get to the end of your life and regret all the things you didn't do .	0
To achieve anything in life you have to believe that you can .	0
"You have the power to change anything , because you are the one who thinks your thoughts and feels your feelings ."	0
You can only think NOW . You can only feel NOW . Your thoughts and feelings NOW are creating your experience . Think about what you want and feel it intensely . NOW !	1
"Carefully consider what you say . Your words are thoughts in action , and they are more powerful than your thoughts alone ."	1
Faith is trusting in the good . Fear is putting your trust in the bad .	0
"If you want to bring more money in your life , does your wallet have space for money or is it full of irrelevant bits of paper ?"	0
There is no outside force that can affect your life unless you give that force power with your thoughts . The greatest power is within you .	1
"You not only create your life with your thoughts , but your thoughts add powerfully to the creation of the world ."	1
Your life is in your hands . Every single circumstance in your life can change .	0
"You are in the perfect place on your perfect journey . You are right where you are meant to be , because you chose it ."	0
Are you thinking more about what you DON'T want than what you DO want ?	0
The things that come most quickly into your life are the things that you BELIEVE in the most .	0
Gratitude is riches and complaint is poverty .	1
"If you think life is hard and a struggle , by the law of attraction you must experience life as hard and a struggle ."	0
You are the cause ; your life is the effect .	0
Even difficult challenges are beautiful opportunities in disguise .	0
If you believe your desire is ‘big’ you are creating the time it takes to manifest . But there is no size or time for the Universe .	1
"Be aware that as you are feeling good , you are powerfully attracting more good things to you ."	1
"Really feel that gratitude , because intense gratitude for what you have holds it to you ."	0
"See it in your mind until it excites and thrills you , and you will most surely hold it in your hands ."	0
Believe and your dreams will grow like wildflowers .	0
"I am whole , perfect , strong , powerful , loving , harmonious , and happy ."	0
"Even if you give just 51 percent good thoughts and good feelings , you have tipped the scales of your life !"	0
"When you have a strong magnetic force of gratitude , like magic , you automatically magnetize everything you want and need to you !"	1
"When your work is your bliss , you will be happy every day ."	0
Life isn't happening to you ; life is responding to you .	1
"If you think about what you want in your mind , and make that your dominant thought , you will bring it into your life ."	1
Your feelings are your frequency feedback mechanism !	1
"For many , the missing link to success is gratitude . You have to be grateful for what you have in order to attract success to you ."	0
What is it you really want ? Focus on the OUTCOME then allow the Universe to use its infinite ways to make it happen .	1
Intend that today is going to be the best day of your life !	1
"You can choose to FEEL GOOD now or you can put it off for a day , week , month or longer . Or you can choose to stay miserable . It's up to you ."	0
Your life is in your hands . . . Every single circumstance of your life can change .	0
"If you're grateful for the money you have , however little , you will see your money magically grow ."	0
You are meant to be living your dreams - all of them !	0
You have the power to change ANYTHING .	0
"If you want to see change in the world , you have to imagine that a perfect peaceful world already exists exactly the way you want it to be ."	0
"The whole point of life is to have fun , to seek happiness , to be happy . That is your one and only purpose in life ."	0
Are you aware of the great creative awareness of your thoughts ?	1
You are worthy of whoever you choose to be .	0
"You have access to all that is , to all that has ever been , and all that will ever be ."	0
You can only become the master of your life by LIVING IT !	0
What do you want more than anything right now ? Think about it a lot – feel it – and you will receive it .	0
What are you most grateful for right now ?	0
"Feel really good about you and you will attract more people , circumstances and events that will make you feel good ."	0
"When you put feeling into the words “ Thank you , ” you give the words wings . Saturate the words with the feeling of gratitude ."	1
The daily practice of gratitude is one of the conduits by which your wealth will come to you .	1
You are a magnet .	0
You’re either choosing to be happy now or you’re making excuses for not choosing to be happy .	0
"If you want a better job , know that each thing you find to be grateful for in your current job helps bring that better job to you ."	0
"No matter how many mistakes you make , no matter what YOU think of you , the Universe absolutely loves you ."	0
"To receive good you must be on the goodness frequency . Think good thoughts , speak good words , and take good actions ."	0
"What you think about most or focus on the most , is what will appear as your life ."	0
In visualizing you fulfill and complete the whole creative process in one hit .	1
"When there is a big change in our life , it means something better is coming . Relax , have faith , and know that the change is ALL GOOD ."	0
"With the use of your will and determined practice of what you have learned , you will be amazed at how fast transformation takes place ."	1
Within you are the exact answers you need to every single question . Ask the question and then wait - the answer will come to you .	0
"Whenever you ask for something for yourself , also ask for the world . Good things for you – good things for the world ."	0
"There are just two words standing between you , happiness , and the life of your dreams … THANK YOU !"	0
Your true work in life is to feel better and keep lifting your frequency .	1
"Imagine your good feelings as rainwater , and keep yourself overflowing by filling yourself with good feelings every day ."	0
Positive thinking is thinking creatively about what you want .	0
"As you experience the power you have to attract , you will move on to creating much bigger things ."	1
"The nature of the Universe is to give . When we are in harmony with the laws of the Universe , we cannot stop ourselves from giving ."	1
Remember that the Universe is moving through everyone and every circumstance to give to you . Open your eyes to the gifts in your life .	1
"You do not have to create what you want - it already exists . That is why the moment you ask and believe , it truly is given to you ."	1
"To shift your life to a higher level , change your frequency . Thoughts , words & deeds of goodness all lift your frequency higher ."	1
"When you feel good , you uplift your life and you uplift the world ."	1
"What you think about the most or focus on the most will materialize , so get creative and focus on what you want ."	0
Appreciation of what you have attracts more of what you want .	0
Follow your own path . Follow your own truth . Follow your own heart . Follow your own bliss and allow each person to follow his or hers .	0
"As money comes to you , it must flow through you like the flow of a river or the flow of money will stop . Be the flow !"	0
Think about what you want to attract . . . see yourself receiving it and feel it as though it has happened !	0
"Happiness is a choice , because it is a feeling generated from the inside of us . Choose to be happy - today and every day !"	0
"When you are feeling good you are on the frequency of receiving , and you will receive what you have asked for ."	1
"When you give , the Universe floods vast amounts of money back to you – multiplied !"	1
"If there were no healing power within us , nothing could be healed ."	1
One person in joy brings so much joy to the world through the magnificent matrix of our Universe .	1
"After you say “ I am tired ” or “ I am broke ” or “ I am sick ” or “ I am overweight , ” the Genie says , “ Your wish is my command . ”"	0
"If fearful thoughts come , stamp them out . Send them on their way and replace them with any thoughts that make you feel good ."	0
"When you feel bad about yourself , you are blocking all the love and all the good that the Universe has for you ."	1
"If you have an intuitive feeling , follow it . You’ll find that the Universe is moving you to receive your desires ."	1
Remember : what you think about the most or focus on the most WILL appear as your life .	0
"Let go of the thought that money can only come to you through your job . If you let that thought go , money can come from anywhere ."	0
"You deserve every good thing , and the Universe will give you every good thing . Your job is to summon it into your life by feeling good ."	0
"When you emit the frequency of believing , the law of attraction moves people , events , and circumstances for you to receive ."	1
"Before you fall asleep tonight , intend that tomorrow is going to be wonderful . Intend that it will be the best day of your life ."	1
"Commit to gaining control of your thoughts . If you dedicate yourself to it , you will become the master of your thoughts - and your life ."	0
"Praising and blessing dissolves all negativity , so as challenging as it may seem , praise and bless anyone or anything negative in your life ."	0
"Trust and have faith in the Universe . Know that the Universe loves you so much , and that everything that happens is all for your good ."	1
Explain to your children that whatever they give returns to them multiplied . You will empower them for the rest of their lives .	0
"The intelligence that is our Universe has only unconditional love for you , because you are You !"	1
"When we don’t love ourselves we literally push things away from us , because the frequency of the Universe is all love ."	1
"You have access to all the wisdom , all the knowledge , and all the power of the Universe - inside you !"	1
"All you require for anything you want is YOU , and your ability to think things into being ."	1
"No one else is the expert on your life . If you think someone is , you have given away all your power . YOU are the expert on your life ."	0
"Your thoughts become things ! Say this to yourself over and over , and let it seep into your consciousness so you never forget it ."	0
"Every human is meant to be in joy . It is your natural state , and there is nothing outside you that can stop you from having it ."	1
"Whatever you desire on any subject – health , wealth , career , love – is on the frequency of joy and feeling good ."	1
Everything you want is an inside job ! The outside world is the world of effects ; it’s just the result of thoughts .	0
"Ask once , believe you have received , and all you have to do to receive is FEEL GOOD ."	0
Make a conscious effort to think and speak ONLY about what you want .	0
"Nothing is incurable . At some point in time , every so-called incurable disease has been cured ."	1
"Focus on the beauty of our world , and how magnificent it is , and you will only see beauty manifesting everywhere you go ."	1
"To live in joy , take a few minutes each day and intentionally send love to everyone you know , and to the world ."	0
"Within You is the infinite creative power , guiding you , loving you , waiting to give you anything and everything you desire ."	1
There is no such thing as a hopeless situation . Every single circumstance of your life can change from a change in your thoughts !	0
"Giving is a powerful action to bring more money into your life , because you are saying , “ I have plenty . ”"	0
When we think positive we bring POSITIVE experiences to us .	0
You are a cosmic being . You are all power . You are all wisdom . You are all intelligence . You are perfection . You are magnificent .	1
If you are focused on illness you are inadvertently bringing more illness through the law of attraction . Focus on health !	0
"Your feelings are communicating with you right now , telling you what frequency you are on – and what you are going to receive ."	1
Your thoughts are the primary cause of everything . When you think a sustained thought it is immediately sent into the Universe .	1
Make it a daily habit to determine how you want events in your day to go – BEFORE the event .	0
"Listen to your thoughts , and listen to the words you are saying , and remember that the law of attraction is responding to every one ."	0
"Money must flow through you like the flow of a river , or the flow of money will stop . Be the flow !"	0
The reason people don’t have what they want is because they’re thinking about what they DON’T want more than what they DO want .	0
"Visualizing emits a powerful frequency , and the law of attraction takes hold of that signal and returns those pictures back to you as your life ."	1
"Focus on the qualities you like about yourself , and the law of attraction will show you more great things about you ."	0
The law of attraction is receiving every thought you have and reflecting them back to you as your life experience .	0
"When you tend to your happiness , you begin to overflow with joy , and every person you come in contact with is touched by your joy ."	0
"Every single person deserves to live a wonderful life , and they have the power to do that through the law of attraction ."	0
"When you say “ I am , ” the words that follow are manifesting with a mighty force , because you are declaring it to be fact ."	1
The key to absolute freedom and joy for each and every one of us is to let go of fear .	0
"Let your imagination go wild with a Vision Board . Place pictures of the things you want , and how you want your life to be ."	0
"Everything that has been created through history began with one thought . From that one thought , a way was made and it manifested ."	1
You have to love YOU . You have to because it is impossible to feel good if you don’t love YOU .	0
Trust your instincts - it’s the Universe inspiring you .	0
"Start to get in touch with how you’re feeling , and then deliberately focus on intensifying a good feeling within you ."	0
"If you’re feeling good , you are not on the same frequency as negative thoughts , words , actions , or events ."	1
"What you’re thinking right now IS manifesting your future . You’re always thinking , and you are always manifesting ."	1
Prosperity is your birth right . You hold the key to more abundance in every area of your life than you can possibly imagine .	1
"If something in your day did not go the way you wanted , replay it in your mind in a way that thrills you ."	0
"Radiate out to the Universe feelings of joy & happiness , and you will attract all things that bring you joy and happiness ."	1
"Get yourself on the ‘feeling good’ frequency , and you will receive ."	1
The shortcut to anything you want in your life is to BE and FEEL happy NOW . It’s the fastest way to anything .	0
"To be in harmony with all the good and all the love you desire , it is time to love You ."	0
"When you wake up , declare your intentions for the day and give deep thanks as though you have received them all ."	0
All good is coming to you today !	0
"Every night before you fall asleep , give heartfelt thanks for the wonderful day you just had ."	0
"If you have a question , direct your asking to the inside of you , believe you will be answered , and you WILL receive an answer ."	0
"To magnetize a life of happiness on the outside , we have to make a decision to be happy NOW on the inside ."	1
YOU are the expert of You and your life !	0
The ONLY thing that can get in the way of any manifestation is having more thoughts of ‘not believing’ than of believing .	1
"If you take a trip , use the power of the Universe through your intention and manifest a beautiful , safe journey ."	1
"As you drive anywhere , make each time you stop a cue for you to say ‘thank you . ’"	0
"As you lift your own life up through good thoughts , words , and deeds , you lift the entire world ."	0
"Be grateful . Be grateful for your imagination . Be grateful you can think , speak , smile , and laugh ."	0
You are in the perfect place on your perfect journey . You are right where you are meant to be .	0
"Remember life is a never-ending game , and you will be playing the game for all of eternity ."	0
"Do things that make you laugh . Do things that make you jump for joy . Dance , sing , skip , and whistle your way through the day . Can you do that today ?"	0
"As you go about your day , keep your attention on how you are feeling , and keep filling yourself up with more and more good feelings ."	0
Permanent happiness comes from your choosing to be happy no matter what .	0
"If you feel things are not getting better , remind yourself : today you are so much more than you were yesterday . You’re greater today !"	0
"Give MORE value than the money you are receiving – in your job , in your business , and in every part of your life ."	0
Give a gift for no reason . Open doors for others . Buy lunch for someone . Give compliments . Give your smile to everyone .	0
"It’s not the challenges we face that matters , but how we choose to look at them , and what we choose to do with those opportunities ."	0
"Appreciate the great times in your life from the past , and appreciate the great times of the future - now ."	0
"Get yourself on to the positive frequency through appreciation , and the law of attraction will surround you with positive people ."	1
"To improve any day immediately , say and feel “ thank you ” seven times in a row ."	0
"Think about what you would do if you had your desire , and then take creative actions that make it clear you are receiving it now ."	0
"Ask yourself if in one day you take more actions that are based in goodness , kindness , gratitude , and love than any other actions ."	0
Didn’t it take practice to walk ? Didn’t it take practice to drive ? Practice is all that stands between you and everything !	0
"Most people ask for health only when they don’t have it , but you can intend great health all the time . And you will attract it ."	0
"Whatever big thing you are asking for , consider having the celebration NOW - as though you have received it already ."	0
"As you walk anywhere , say ‘thank you’ in your mind with each step you take ."	0
"The law of attraction is exact , precise , and never fails . So , when it appears it isn’t working , you can be guaranteed it’s not the law failing ."	0
"To be a magnet of happiness requires feeling happy , thinking happy thoughts , and acting with happiness towards others ."	1
There is nothing more important than repaying kindness .	0
"You are responsible for your frequency , which is determined by your thoughts , words , feelings , and actions . Lift yourself higher - now ."	1
"You are going to receive the most amazing , incredible , fantastic news today ."	0
"When you can maintain peace and joy within you despite any situation on the outside , you have become the master of everything ."	0
"Think of all the good things in your life , and realize that YOU brought them all into your life . You are a powerful human being ."	0
"Be grateful . Be grateful for your loved ones , your friends , your child , your pet . . . for your ability to love and be loved ."	0
Use the power of your intention every day to see yourself and others healthy and well .	1
"There is only One Infinite Power , and it can only be used for the positive and the good ."	1
A feeling of peace in your mind and body puts you on a frequency of harmony with the Universe .	1
"To help someone who has problems with their health , visualize in your mind the person being strong , happy , and healthy ."	0
"To manifest a beautiful future , think thoughts of goodness , speak good and kind words , and make sure your actions come from goodness ."	1
"You manifest your future with the power of your intention , which is simply the conscious act of determining your future NOW ."	1
Ask yourself if in one day you think more thoughts and speak more words of goodness and love than any other thoughts or words .	0
"Base the majority of your thoughts , words , and actions in BELIEVING , and the law of attraction must obey you ."	0
