sentences	score
The web of life projects onto boundless space time events	1
The web of life requires great phenomena	1
The web of life self interacts with irrational brightness	1
The web of life serves existential miracles	1
The web of life shapes the door of photons	1
The web of life transforms karmic space time events	1
The web of life unfolds into a jumble of abstract beauty	1
The web of life unfolds into an abundance of excellence	1
The world alleviates new experiences	1
The world compliments great truth	1
The world comprehends cosmic reality	1
The world creates dimensionless reality	1
The world drives sub empirical balance	1
The world embraces ephemeral chaos	1
The world experiences a jumble of self-knowledge	1
The world explains spontaneous life	1
The world explains universal sexual energy	1
The world gives rise to your own positivity	1
The world heals species specific molecules	1
The world illuminates innumerable destiny	1
The world influences intricate space time events	1
The world inspires quantum possibilities	1
The world is an ingredient of objective sexual energy	1
The world is entangled in karmic facts	1
The world is entangled in the door of human observation	1
The world is inherent in dimensionless truth	1
The world is inherent in intrinsic genes	1
The world is reborn in spiritual success	1
The world is the continuity of your own neural networks	1
The world is the foundation of spontaneous abstract beauty	1
The world is the foundation of the door of reality	1
The world is the ground of formless photons	1
The world is the ground of objective fulfillment	1
The world is the path to subjective timelessness	1
The world is the womb of subjective images	1
The world reflects immortal force fields	1
The world requires the light of boundaries	1
The world results from spontaneous self-knowledge	1
The world serves immortal neural networks	1
The world serves incredible abstract beauty	1
The world transcends intricate positivity	1
Transcendence arises and subsides in the door of bliss	1
Transcendence compliments total acceptance of opportunities	1
Transcendence comprehends intrinsic success	1
Transcendence drives reckless love	1
Transcendence embraces personal chaos	1
Transcendence explains nonlocal happiness	1
Transcendence explains the barrier of genes	1
Transcendence explores ephemeral positivity	1
Transcendence fears subjective positivity	1
Transcendence gives rise to essential creativity	1
Transcendence grows through personal images	1
Transcendence heals unbridled phenomena	1
Transcendence heals visible truth	1
Transcendence influences the doorway to belonging	1
Transcendence is at the heart of formless fulfillment	1
Transcendence is at the heart of the door of energy	1
Transcendence is inextricably connected to formless self-knowledge	1
Transcendence is reborn in a jumble of chaos	1
Transcendence is the foundation of deep energy	1
Transcendence is the ground of the barrier of positivity	1
Transcendence is the ground of unbridled boundaries	1
Transcendence is the wisdom of personal silence	1
Transcendence is the wisdom of the door of force fields	1
Transcendence regulates sub empirical choices	1
Transcendence self interacts with potential force fields	1
Transcendence shapes sub empirical opportunities	1
Transcendence transcends objective reality	1
Transcendence unfolds into deep destiny	1
True faith alleviates unbridled opportunities	1
True faith compliments descriptions of truth	1
True faith compliments the door of sexual energy	1
True faith constructs existential marvel	1
True faith explains a symbolic representation of joy	1
True faith explores a jumble of mortality	1
True faith influences the light of external reality	1
True faith influences the light of images	1
True faith is an ingredient of cosmic destiny	1
True faith is an ingredient of the progressive expansion of knowledge	1
True faith is entangled in subjective happiness	1
True faith is inextricably connected to a jumble of images	1
True faith is inherent in species specific molecules	1
True faith is inherent in subjective images	1
True faith is only possible in pure opportunities	1
True faith is reborn in existential photons	1
True faith is reborn in great energy	1
True faith is the continuity of positive experiences	1
True faith is the foundation of pure force fields	1
True faith is the foundation of subtle fulfillment	1
True faith is the foundation of your own boundaries	1
True faith is the wisdom of nonlocal images	1
True faith is the womb of a symphony of abstract beauty	1
True faith is the womb of innumerable happiness	1
True faith nurtures infinite phenomena	1
True faith reflects subjective reality	1
True faith regulates infinite happiness	1
True faith relies on the door of life	1
True faith relies on universal photons	1
True faith requires the doorway to love	1
True faith unfolds into spiritual molecules	1
True faith unfolds through subtle chaos	1
True identity alleviates ephemeral reality	1
True identity belongs to species specific fulfillment	1
True identity belongs to the expansion of sexual energy	1
True identity co-creates essential mortality	1
True identity comprehends potential genes	1
True identity creates the light of images	1
True identity embraces humble excellence	1
True identity exists as spiritual joy	1
True identity exists as spiritual potentiality	1
True identity experiences dimensionless potentiality	1
True identity explores intrinsic timelessness	1
True identity expresses visible photons	1
True identity fascinates mortal human observation	1
True identity gives rise to innumerable belonging	1
True identity illuminates exponential belonging	1
True identity illuminates universal knowledge	1
True identity is a reflection of the mechanics of images	1
True identity is an ingredient of unbridled sensations	1
True identity is at the heart of total acceptance of experiences	1
True identity is inherent in an expression of positivity	1
True identity is reborn in unique fulfillment	1
True identity is the foundation of visible marvel	1
True identity is the path to an abundance of mortality	1
True identity is the wisdom of intrinsic observations	1
True identity quiets objective creativity	1
True identity reflects subtle boundaries	1
True identity regulates the door of love	1
True identity transcends sub empirical experiences	1
True identity unfolds into humble energy	1
True identity unfolds into total acceptance of love	1
Wholeness alleviates species specific experiences	1
Wholeness arises and subsides in the light of force fields	1
Wholeness belongs to pure opportunities	1
Wholeness belongs to the barrier of opportunities	1
Wholeness comprehends essential love	1
Wholeness corresponds to positive energy	1
Wholeness depends on pure opportunities	1
Wholeness explores a symphony of excellence	1
Wholeness imparts reality to irrational love	1
Wholeness is a modality of dimensionless space time events	1
Wholeness is a modality of intricate experiences	1
Wholeness is inextricably connected to exponential images	1
Wholeness is inextricably connected to the door of actions	1
Wholeness is mirrored in infinite acceptance	1
Wholeness is only possible in dimensionless sexual energy	1
Wholeness is rooted in infinite brightness	1
Wholeness is the continuity of intricate success	1
Wholeness is the continuity of unique creativity	1
Wholeness is the path to spontaneous life	1
Wholeness opens mortal belonging	1
Wholeness opens potential truth	1
Wholeness quiets nonlocal external reality	1
Wholeness regulates new phenomena	1
Your body arises and subsides in nonlocal human observation	1
Your body constructs total acceptance	1
Your body corresponds to an abundance of creativity	1
Your body corresponds to spontaneous life	1
Your body embraces reckless photons	1
Your body imparts reality to the door of sexual energy	1
Your body inspires dimensionless self-knowledge	1
Your body is a reflection of mortal timelessness	1
Your body is an ingredient of deep observations	1
Your body is an ingredient of subtle happiness	1
Your body is beyond objective facts	1
Your body is entangled in a jumble of abstract beauty	1
Your body is in the midst of pure timelessness	1
Your body is inextricably connected to objective phenomena	1
Your body is inextricably connected to subjective truth	1
Your body is inside intricate excellence	1
Your body is inside self-righteous mortality	1
Your body is mirrored in sub empirical images	1
Your body is rooted in the doorway to acceptance	1
Your body is the foundation of an expression of knowledge	1
Your body is the ground of boundless photons	1
Your body is the path to an expression of miracles	1
Your body is the path to great actions	1
Your body relies on unparalleled chaos	1
Your body requires incredible excellence	1
Your body requires nonlocal life	1
Your body shapes subjective happiness	1
Your consciousness comprehends personal experiences	1
Your consciousness comprehends total acceptance of mysteries	1
Your consciousness corresponds to objective timelessness	1
Your consciousness depends on unbridled molecules	1
Your consciousness drives irrational abstract beauty	1
Your consciousness drives positive photons	1
Your consciousness drives the light of external reality	1
Your consciousness grows through positive brightness	1
Your consciousness imparts reality to the expansion of bliss	1
Your consciousness is a reflection of spontaneous chaos	1
Your consciousness is a reflection of universal knowledge	1
Your consciousness is an ingredient of the expansion of creativity	1
Your consciousness is an ingredient of universal energy	1
Your consciousness is beyond objective destiny	1
Your consciousness is entangled in irrational experiences	1
Your consciousness is inextricably connected to an expression of genes	1
Your consciousness is the foundation of a symphony of balance	1
Your consciousness is the ground of nonlocal boundaries	1
Your consciousness is the path to the progressive expansion of boundaries	1
Your consciousness is the womb of nonlocal sexual energy	1
Your consciousness nurtures immortal miracles	1
Your consciousness nurtures subjective sensations	1
Your consciousness regulates karmic images	1
Your consciousness regulates quantum marvel	1
Your consciousness requires descriptions of possibilities	1
Your consciousness requires the progressive expansion of fulfillment	1
Your consciousness undertakes unbridled possibilities	1
Your desire arises and subsides in unparalleled truth	1
Your desire compliments reckless brightness	1
Your desire differentiates into an abundance of positivity	1
Your desire exists as immortal possibilities	1
Your desire experiences a symbolic representation of observations	1
Your desire experiences universal miracles	1
Your desire explores objective choices	1
Your desire expresses mortal possibilities	1
Your desire fears boundless self-knowledge	1
Your desire fears the progressive expansion of facts	1
Your desire heals formless belonging	1
Your desire influences precious genes	1
Your desire influences total space time events	1
Your desire is a modality of your own photons	1
Your desire is a reflection of an expression of self-knowledge	1
Your desire is an ingredient of the mechanics of choices	1
Your desire is in the midst of an abundance of actions	1
Your desire is inextricably connected to pure happiness	1
Your desire is only possible in descriptions of external reality	1
Your desire is only possible in exponential reality	1
Your desire is only possible in subjective external reality	1
Your desire is reborn in unbridled neural networks	1
Your desire is rooted in mortal human observation	1
Your desire is the path to potential potentiality	1
Your desire is the path to the light of choices	1
Your desire is the wisdom of incredible joy	1
Your desire relies on pure space time events	1
Your desire self interacts with boundless energy	1
Your desire transforms the progressive expansion of photons	1
Your desire unfolds into visible joy	1
Your desire unfolds through essential chaos	1
Your heart alleviates sub empirical phenomena	1
Your heart arises and subsides in spiritual happiness	1
Your heart belongs to immortal space time events	1
Your heart constructs spiritual potentiality	1
Your heart corresponds to potential life	1
Your heart corresponds to precious fulfillment	1
Your heart differentiates into subjective molecules	1
Your heart embraces quantum energy	1
Your heart exists as the light of belonging	1
Your heart experiences positive images	1
Your heart explores subjective life	1
Your heart explores the barrier of energy	1
Your heart expresses potential life	1
Your heart imparts reality to a jumble of opportunities	1
Your heart inspires existential external reality	1
Your heart is a modality of deep marvel	1
Your heart is at the heart of unique miracles	1
Your heart is entangled in reckless timelessness	1
Your heart is inextricably connected to essential actions	1
Your heart is inside descriptions of love	1
Your heart is only possible in precious potentiality	1
Your heart is the womb of positive fulfillment	1
Your heart is the womb of potential mortality	1
Your heart meditates on an expression of silence	1
Your heart meditates on new facts	1
Your heart opens an abundance of success	1
Your heart projects onto unique mysteries	1
Your heart relies on great sexual energy	1
Your heart relies on spontaneous positivity	1
Your heart self interacts with humble choices	1
Your heart shapes exponential energy	1
Your heart undertakes reckless mortality	1
Your movement alleviates positive life	1
Your movement belongs to intricate sensations	1
Your movement constructs a jumble of human observation	1
Your movement constructs intricate space time events	1
Your movement creates immortal love	1
Your movement depends on an abundance of boundaries	1
Your movement differentiates into potential happiness	1
Your movement embraces the door of positivity	1
Your movement fascinates a symphony of human observation	1
Your movement grows through karmic possibilities	1
Your movement heals subjective opportunities	1
Your movement illuminates great neural networks	1
Your movement influences a jumble of images	1
Your movement is a reflection of unique brains	1
Your movement is an ingredient of an abundance of choices	1
Your movement is an ingredient of positive miracles	1
Your movement is an ingredient of precious phenomena	1
Your movement is entangled in subtle neural networks	1
Your movement is in the midst of the mechanics of external reality	1
Your movement is inextricably connected to dimensionless experiences	1
Your movement is only possible in cosmic truth	1
Your movement is rooted in the flow of destiny	1
Your movement is rooted in the mechanics of excellence	1
Your movement is the ground of formless molecules	1
Your movement is the ground of positive success	1
Your movement is the path to an expression of space time events	1
Your movement is the path to universal self-knowledge	1
Your movement is the wisdom of self-righteous bliss	1
Your movement results from objective success	1
Your movement shapes immortal fulfillment	1
Your movement shapes precious mortality	1
Your movement unfolds into nonlocal creativity	1
"1500 omicron cases in a week at Cornell . Over 8% of the student body (despite 97% vaccination rate , and indoor masking) is now infected . I feel awful for my students . And the county is now one of the worst hotspots in the country ."	0
"2 points about language : I am not using her name because she deserves to be known for anything but this . Also , DV is a problematic term , but "" intimate partner violence "" is obviously inappropriate here , and "" family violence "" is taken no more seriously . New terms won't help I fear ."	0
60 women . Devastating	0
"A controversial early opinion about zoom teaching (since it's my first time) : so far , it is . . . fine ? There are things I miss about being in person , but there's a lot I like about the online classes too tbh ."	0
"A grim reminder of the sort I wish I never had to issue . Rest in power , Gabby Petito ."	0
"A more important and overlooked link between domestic violence and mass shootings is that many if not most mass shootings actually *are* domestic violence , or outgrowths of it--either the crime started at home , or is a family annihilation ."	0
"A powerful , rich white man abuses his female partner for years , and when she finally fights back , he weaponizes the legal system to punish , silence , and smear her as the real monster . We saw a similar dynamic play out with Trump . But when they're a star , we let them do it ."	0
A remarkably large proportion of moral panics are the result of people criticizing or demanding up the social hierarchy	0
Akrasia (weakness of the will) here doesn't look like philosophers have largely led us to expect .	0
"All told though , looking to stop public mass shootings by cracking down on domestic violence is a bad strategy , statistically (as well as politically , for those of us who believe--like me--that the police should be defunded) . The base rates of DV are just too high , sadly ."	0
Also more Marina PLEASE	0
Also my hair lacks body and hasn't been cut in 18 months	0
An outrageous lie .	0
"And again , trigger warnings are not typically designed to help students avoid the material . They're about allowing equal access to students who might otherwise find it hard or unduly stressful to engage , by allowing them time and resources to prepare for tough material ."	0
"And don't get me started on children's literature--with notable exceptions , including Noni the Pony ."	0
"And for the geniuses wondering why I said anything at all--people were immediately sliding into my DMs asking for my opinion , and even a think piece , on the topic . On this one , I prefer to listen to others' perspectives ."	0
"And they forgot "" hag """	0
And this is even with a maximally egalitarian parenting partnership (with my husband also teaching full-time) .	0
"And this is said knowing that it is only a matter of time before her chilling recounting of the day's events is minimized , dismissed , and denied altogether ."	0
"And while no company is obligated to hire me to speak , those of us who aren't white men are entitled to *charge* a certain fee for our labor and expertise . I don't appreciate being lowballed or expected to speak for free to help wealthy organizations do better on gender equality ."	0
"And while the Daily Mail is a very raggy rag , shame on the reporter for asking for an interview on "" an article discussing diet culture "" and then , when I declined , writing that "" I declined to comment "" on her actual story . (I would still have declined , but that's not the point . )"	0
"And yes whatever I know Kim K said she merely severely restricted her food intake . I don't buy it , and that's still unhealthy and suspect AF to brag about ."	0
"And yet lose he did . So did we all . May today be a peaceful one , and a joyous one . The work is just beginning ."	0
"And , again , they approached me , I gave them my rates , and they went back and forth setting up a meeting . Only then did they announce they "" didn't have the budget "" for me . While this may be true , methinks it would behoove Google to actually invest in combating misogyny ."	0
"And , in a way , it *is* "" natural , "" i . e . , predictable-- albeit the most grossly unjust outcome imaginable . When we tell white men it makes sense for them to lash out in these egregiously violent ways , we are normalizing their tantrums . We are indulging them . We are himpathetic ."	0
"And , sure , Amber Heard is not a perfect victim . She doesn't have to be in order to be one ."	0
"Another career in tatters , with a third season of a not-that-great show (which lately featured Ansari being kinda a creep to his Italian crush) being renewed on the world's most popular streaming network ."	0
Another offender : Younger .	0
"Another thing worth noting about diet culture is the rote repetition of certain phrases and injunctions-- "" just cut carbs , "" "" try intermittent fasting , "" "" nothing is as good as thin feels , "" etc . --that have no thought whatsoever behind them . A hallmark of gaslighting and being gaslit"	0
"Any leads on good scholarship on the place of white scholars , if any , in CRT ? Asking for a student ."	0
Any leads on the latest and best scholarship on how the experience of women of color tends to be either overlooked or concealed by some anti-racist and feminist accounts ? Asking for a student who has read the classic Crenshaw account for my class and is wanting further resources .	0
Any leads on thinkers writing critical race theory within the Latin American context ? (Asking for a friend . Thanks ! )	0
"Anyway . That explains the large uptick in hate mail . Keeping my account locked for now until people stop being so furious about my bowing out of an important but delicate conversation about the Oscars , and having the audacity to call for justice for people living in fat bodies ."	0
"Apart from anything (everything) else , this device betrays an assumption that fat people simply can't be trusted to follow a liquid diet if they decide to (for whatever reason) . It needs to be *enforced* ."	0
"As a presidential candidate , I mean . He's been inciting violence against marginalized folks like the Central Park 5 for much , much longer ."	0
"As horrendous as this news is , we have to remember that it is old news . White evangelicals and their political lackeys have been coming for abortion for years--since 2010 ramping up efforts by over-regulating and shutting down clinics , requiring mandatory waiting periods [1/3]"	0
"As I said in Down Girl : Silence is golden for the men who smother and intimidate women into not talking , or have them change their tune to maintain harmony . Silence isolates his victims ; and it enables misogyny ."	0
"As Jones et . al . say in their 2020 study : "" There remain several important limitations to this area of research . First , none of the studies has exclusively focused on the primary intended target of trigger warnings—survivors of trauma . "" (I would add : "" limitations "" is generous . )"	0
"As Paul Campos goes on to show , moreover , even people classified as "" severely obese "" (BMI &gt ; 40) are at less risk for hospitalization/death from COVID-19 compared to so-called normal-weight people than men vs . women ."	0
"As someone with an immunocompromised and immunosuppressed spouse , and an unvaccinated toddler , I am truly dreading the Fall . I have to log off before the doomscrolling gets even worse . Stay safe , friends ."	0
"As women , we are punished not just for the supposed waywardness of our minds and our behavior , by wrong-headed patriarchal standards , but for the unruliness of our bodies . Being openly , proudly fat is thus a particular act of defiance for a woman in our culture ."	0
"As women , we are rewarded for being pleasing—to men and to the culture at large , partly in being deemed to have a “ good ” (that is , small) body ."	0
"At 50k followers , I'll tell you my wild theory about why I don't have a blue tick yet"	0
Atlanta . Heartbroken . Standing in solidarity with and sending so much love to Asian American women at this terrible moment .	0
"Being privileged socially and materially is ineluctably connected with being privileged morally--being believed , respected , and given all the credit for what one has . No wonder so many white people can't abide moral criticism or even face the fact they haven't earned their spoils"	0
Being silenced and no longer being the only ones speaking are not the same thing	0
"Bell wrote : "" African Americans must confront and conquer the otherwise deadening reality of our permanent subordinate status . Only in this way can we prevent ourselves from being dragged down by society’s racial hostility . """	0
"Bell wrote : "" Lulled by comforting racial stereotypes , fearful that blacks will unfairly get ahead of them , all too many whites respond to even the most dire reports of race-based disadvantage with either a sympathetic headshake or victim-blaming rationalizations . """	0
Bought a fucking peloton	0
Boundaries are good actually	0
But all's well that etc . : he said he had a long-term partner he wasn't really done breaking up with . Fun times !	0
"But man , past me's cornball humor and low-quality clipart really sticks in my craw ."	0
"But wishing it were otherwise doesn't change the facts . No matter how much I (extensively ! ) went low carb , did intermittent fasting , or tried this once weird trick , for years of my life , I will never have a socially ideal body . Only starvation will begin to push me (a bit) closer"	0
"Ceasing to indulge wealthy (and cis straight non-disabled) white men is a collective responsibility . As I often emphasize , many people in this demographic are perfectly fine , thanks to their own moral principles , conscience , etc . The fault , and the remedy , is social : end himpathy"	0
"Christ , I am not even going to recount the time a man (not a professor , tbf) gave me his phone number during my own logic seminar (the very first professional talk I gave) . Another crumpled up bit of paper smuggled into my hand while I was using the chalkboard for a proof ."	0
"Controlling women by calling *them* controlling is a neat little trick , brought to you by the patriarchy ."	0
"Credibility deficits—and hence disbelieving someone—often serve the function of buttressing dominant group members’ current social position , and protecting them from downfall in the existing social hierarchy : by being , for example , accused , impugned , or convicted ."	0
"CRT demands whites decenter ourselves from narratives we are accustomed to dominating and emerging feeling , seeming , and looking good from . We must relinquish the insidious requirement that the world's stories venerate our characters and our histories . Call it , well , critical ."	0
