sentence	score
A poignant lyricism runs through Balzac and the Little Chinese Seamstress that transforms this story about love and culture into a cinematic poem.	3.71428571429
Succeeds in providing a disquiet world the long-dreaded completion of the Police Academy series.	2.71428571429
The movie is as far as you can get from racy, to the point where it almost stops the blood flow to your brain; it has a dull, costumey feel.	2.0
The title Trapped turns out to be a pretty fair description of how you feel while you're watching this ultra-manipulative thriller.	4.0
Denver should not get the first and last look at one of the most triumphant performances of Vanessa Redgrave's career. It deserves to be seen everywhere.	3.66666666667
Overall the film feels like a low-budget TV pilot that could not find a buyer to play it on the tube.	2.16666666667
While the ideas about techno-saturation are far from novel, they're presented with a wry dark humor.	2.85714285714
A work of intricate elegance, literary lyricism and profound common sense.	1.85714285714
Informative, intriguing, observant, often touching...gives a human face to what's often discussed in purely abstract terms.	2.0
Schneider's mugging is relentless and his constant need to suddenly transpose himself into another character undermines the story's continuity and progression.	3.4
Much like its easily dismissive take on the upscale lifestyle, there isn't much there here.	2.0
Some of their jokes work, but most fail miserably and in the end, Pumpkin is far more offensive than it is funny.	3.71428571429
Even if you don't think (Kissinger's) any more guilty of criminal activity than most contemporary statesmen, he'd sure make a courtroom trial great fun to watch.	4.0
The performers are so spot on, it is hard to conceive anyone else in their roles.	1.6
Episode II-- Attack of the Clones is a technological exercise that lacks juice and delight.	3.57142857143
For all its highfalutin title and corkscrew narrative, the movie turns out to be not much more than a shaggy human tale.	2.0
For more than two decades Mr. Nachtwey has traveled to places in the world devastated by war, famine and poverty and documented the cruelty and suffering he has found with an devastating, eloquent clarity.	4.0
Do not, under any circumstances, consider taking a child younger than middle school age to this wallow in crude humor.	2.33333333333
Credit director Ramsay for taking the sometimes improbable story and making it feel realistic.	3.28571428571
``The turntable is now outselling the electric guitar...''	1.66666666667
Digital-video documentary about stand-up comedians is a great glimpse into a very different world.	3.0
They takes a long time to get to its gasp-inducing ending.	1.6
Although very much like the first movie based on J.K. Rowling's phenomenal fantasy best sellers, this second go-round possesses a quite pleasing, headlong thrust and a likably delinquent attitude.	3.85714285714
Van Wilder brings a whole new meaning to the phrase 'comedy gag.' At least one scene is so disgusting that viewers may be hard pressed to retain their lunch.	4.0
Lookin' for sin, American-style? Try Hell House, which documents the cautionary Christian spook-a-rama of the same name.	4.57142857143
The things this movie tries to get the audience to buy just won't fly with most intelligent viewers.	1.85714285714
Now here's a sadistic bike flick that would have made Vittorio De Sica proud.	2.83333333333
A provocative movie about loss, anger, greed, jealousy, sickness and love.	1.85714285714
Occasionally funny and consistently odd, and it works reasonably well as a star vehicle for Zhao.	2.85714285714
Well-nigh unendurable...though the picture strains to become cinematic poetry, it remains depressingly prosaic and dull.	2.16666666667
The biggest problem with this movie is that it's not nearly long enough.	2.0
Some fine acting, but ultimately a movie with no reason for being.	1.57142857143
About as cutting-edge as Pet Rock: The Movie.	2.28571428571
Observant intelligence constantly vies with pretension -- and sometimes plain wacky implausibility -- throughout Maelstrom.	3.14285714286
A plethora of engaging diatribes on the meaning of 'home,' delivered in grand passion by the members of the various households.	2.57142857143
The performances are strong, though the subject matter demands acting that borders on hammy at times.	2.0
It all adds up to good fun.	1.5
Payami tries to raise some serious issues about Iran's electoral process, but the result is a film that's about as subtle as a party political broadcast.	3.14285714286
The film's best trick is the way that it treats conspiracy as a kind of political Blair Witch, a monstrous murk that haunts us precisely because it can never be seen.	3.0
A visually flashy but narratively opaque and emotionally vapid exercise in style and mystification.	2.0
This examination of aquatic life off the shores of the Baja California peninsula of Mexico offers an engrossing way to demonstrate the virtues of the IMAX format.	3.85714285714
The inspirational screenplay by Mike Rich covers a lot of ground, perhaps too much, but ties things together, neatly, by the end.	4.0
Beneath Clouds is a succinct low-budget film whose compelling characters and intelligent script are exactly what was missing from Rabbit-Proof Fence.	4.8
Ostensibly celebrates middle-aged girl power, even as it presents friendship between women as pathetic, dysfunctional and destructive.	3.0
Whereas last year's exemplary Sexy Beast seemed to revitalize the British gangster movie, this equally brutal outing merely sustains it.	3.33333333333
Although it lacks the detail of the book, the film does pack some serious suspense.	2.42857142857
The film is a travesty of the genre and even as spoof takes itself too seriously.	2.42857142857
Quick: who wants to see a comedy about shoddy airport security?	1.66666666667
The film is so busy making reference to other films and trying to be other films that it fails to have a heart, mind or humor of its own.	2.57142857143
(Russell) makes good B movies (The Mask, The Blob), and The Scorpion King more than ably meets those standards.	3.5
You walk out of The Good Girl with mixed emotions -- disapproval of Justine combined with a tinge of understanding for her actions.	3.16666666667
What puzzles me is the lack of emphasis on music in Britney Spears' first movie.	3.42857142857
...Myers has turned his franchise into the movie version of an adolescent dirty-joke book done up in post-Tarantino pop-culture riffs...	3.375
Several uninteresting, unlikeable people do bad things to and with each other in ``Unfaithful.'' Why anyone who is not a character in this movie should care is beyond me.	2.8
A vivid, sometimes surreal, glimpse into the mysteries of human behavior.	2.0
Somehow both wildly implausible and strangely conventional.	1.83333333333
Those who aren't put off by the film's austerity will find it more than capable of rewarding them.	2.14285714286
A chronicle not only of one man's quest to be president, but of how that man single-handedly turned a plane full of hard-bitten, cynical journalists into what was essentially, by campaign's end, an extended publicity department.	3.85714285714
A lean, deftly shot, well-acted, weirdly retro thriller that recalls a raft of '60s and '70s European-set spy pictures.	4.2
Even legends like Alfred Hitchcock and John Huston occasionally directed trifles... so it's no surprise to see a world-class filmmaker like Zhang Yimou behind the camera for a yarn that's ultimately rather inconsequential.	4.0
Griffin & Co. manage to be spectacularly outrageous.	2.75
Some may choose to interpret the film's end as hopeful or optimistic but I think Payne is after something darker.	2.85714285714
Baran isn't the most transporting or gripping film from Iran -- or, indeed, by its director -- but it's a worthy companion to the many fine, focused films emerging from that most surprising of nations.	3.42857142857
plays like some corny television production from a bygone era	2.2
A series of escapades demonstrating the adage that what is good for the goose is also good for the gander, some of which occasionally amuses but none of which amounts to much of a story.	1.85714285714
Whether seen on a 10-inch television screen or at your local multiplex, the edge-of-your-seat, educational antics of Steve Irwin are priceless entertainment.	3.57142857143
It will break your heart many times over.	1.14285714286
It's truly awful and heartbreaking subject matter, but one whose lessons are well worth revisiting as many times as possible.	2.57142857143
Enticing and often funny documentary.	2.0
The film reminds me of a vastly improved Germanic version of My Big Fat Greek Wedding -- with better characters, some genuine quirkiness and at least a measure of style. The difference is that I truly enjoyed most of Mostly Martha while I ne	3.625
It's the kind of movie you can't quite recommend because it is all windup and not much of a pitch, yet you can't bring yourself to dislike it.	2.0
Imagine a really bad community theater production of West Side Story without the songs.	2.42857142857
When the first few villians are introduced as ``Spider'' and ``Snake'' you know you're in for a real winner, creativity at its peak.	3.0
I can only imagine one thing worse than Kevin Spacey trying on an Irish accent, and that's sultry Linda Fiorentino doing the same thing.	3.33333333333
Mostly works because of the universal themes, earnest performances ... and excellent use of music by India's popular Gulzar and Jagjit Singh.	3.57142857143
Why would anyone cast the magnificent Jackie Chan in a movie full of stunt doubles and special effects?	3.57142857143
It is parochial, accessible to a chosen few, standoffish to everyone else, and smugly suggests a superior moral tone is more important than filmmaking skill	2.57142857143
Vera's three actors -- Moll, Gil and Bardem -- excel in insightful, empathetic performances.	4.0
Before it takes a sudden turn and devolves into a bizarre sort of romantic comedy, Steven Shainberg's adaptation of Mary Gaitskill's harrowing short story ... is a brilliantly played, deeply unsettling experience.	4.0
A film of quiet power.	1.71428571429
You're not merely watching history, you're engulfed by it.	2.28571428571
(At least) Moore is a real charmer.	2.57142857143
Hardly a masterpiece, but it introduces viewers to a good charitable enterprise and some interesting real people.	2.0
Together writer-director Danny Verete's three tales comprise a powerful and reasonably fulfilling gestalt.	3.4
Leaping from one arresting image to another, Songs from the Second Floor has all the enjoyable randomness of a very lively dream and so manages to be compelling, amusing and unsettling at the same time.	3.33333333333
Meant for Star Wars fans. It is there to give them a good time.	2.0
Heavy with flabby rolls of typical Toback machinations.	2.66666666667
Smart and fun, but far more witty than it is wise.	2.0
Weaves a spell over you, with its disturbingly close-up look at damaged psyches and its subtle undercurrents of danger. But its awkward structure keeps breaking the spell.	2.85714285714
... understands that a generation defines its music as much as the music defines a generation.	1.66666666667
The result is more depressing than liberating, but it's never boring.	1.71428571429
What makes Esther Kahn so demanding is that it progresses in such a low-key manner that it risks monotony. But it's worth the concentration.	3.625
The smug, oily demeanor that Donovan adopts throughout the stupidly named Pipe Dream is just repulsive.	3.66666666667
While the now 72-year-old Robert Evans been slowed down by a stroke, he has at least one more story to tell: his own.	4.28571428571
A delicious and delicately funny look at the residents of a Copenhagen neighborhood coping with the befuddling complications life tosses at them.	3.71428571429
Anchored by Friel and Williams's exceptional performances, the film's power lies in its complexity. Nothing is black and white.	3.8
Succeeds only because Bullock and Grant were made to share the silver screen.	3.6
'The War of the Roses,' trailer-trash style. Entertaining but like shooting fish in a barrel.	2.6
An amusing and unexpectedly insightful examination of sexual jealousy, resentment and the fine line between passion and pretence.	2.8
Everything about The Quiet American is good, except its timing.	2.71428571429
Ruzowitzky has taken this mothball-y stuff and made a rather sturdy, old-fashioned entertainment out of it.	3.2
A film about female friendship that men can embrace and women will talk about for hours.	2.16666666667
From spiritual rebirth to bruising defeat, Vincent's odyssey resonates in a profound way, comparable to the classic films of Jean Renoir.	3.71428571429
I know we're not supposed to take it seriously, but I can't shake the thought that Undercover Brother missed an opportunity to strongly present some profound social commentary.	3.57142857143
Tully is worth a look for its true-to-life characters, its sensitive acting, its unadorned view of rural life and the subtle direction of first-timer Hilary Birmingham.	4.0
The tug-of-war at the core of Beijing Bicycle becomes weighed down with agonizing contrivances, overheated pathos and long, wistful gazes.	3.5
A movie that's just plain awful but still manages to entertain on a guilty-pleasure, so-bad-it's-funny level.	1.85714285714
The story itself is actually quite vapid.	2.28571428571
The film is itself a sort of cinematic high crime, one that brings military courtroom dramas down very, very low.	2.71428571429
A very depressing movie of many missed opportunities.	1.6
While it is welcome to see a Chinese film depict a homosexual relationship in a mature and frank fashion, Lan Yu never catches dramatic fire.	3.83333333333
A big meal of cliches that the talented cast generally chokes on.	1.83333333333
His best film remains his shortest, The Hole, which makes many of the points that this film does but feels less repetitive.	3.2
Hardly a film that comes along every day.	1.0
Recoing's fantastic performance doesn't exactly reveal what makes Vincent tick, but perhaps any definitive explanation for it would have felt like a cheat.	3.2
This fascinating experiment plays as more of a poetic than a strict reality, creating an intriguing species of artifice that gives The Lady and the Duke something of a theatrical air.	4.14285714286
The images are usually abbreviated in favor of mushy obviousness and telegraphed pathos, particularly where Whitaker's misfit artist is concerned.	3.42857142857
If S&M seems like a strange route to true love, maybe it is, but it's to this film's (and its makers') credit that we believe that that's exactly what these two people need to find each other -- and themselves.	3.71428571429
The film overcomes the regular minefield of coming-of-age cliches with potent doses of honesty and sensitivity.	2.4
Like Kubrick, Soderbergh isn't afraid to try any genre and to do it his own way.	2.85714285714
A moving story of determination and the human spirit.	1.85714285714
The tasteful little revision works wonders, enhancing the cultural and economic subtext, bringing richer meaning to the story's morals.	2.57142857143
There are plenty of scenes in Frida that do work, but rarely do they involve the title character herself.	3.2
Neither quite a comedy nor a romance, more of an impish divertissement of themes that interest Attal and Gainsbourg -- they live together -- the film has a lot of charm.	3.0
Pacino is the best he's been in years and Keener is marvelous.	2.85714285714
The talented and clever Robert Rodriguez perhaps put a little too much heart into his first film and didn't reserve enough for his second.	3.16666666667
With so many bad romances out there, this is the kind of movie that deserves a chance to shine.	2.0
It's not difficult to spot the culprit early-on in this predictable thriller.	1.8
It's neither as romantic nor as thrilling as it should be. But it offers plenty to ponder and chew on as its unusual relationship slowly unfolds.	2.57142857143
While certain cues, like the happy music, suggest that this movie is supposed to warm our hearts, Jeong-Hyang Lee's film is just as likely to blacken that organ with cold vengefulness.	3.57142857143
While the humor is recognizably Plympton, he has actually bothered to construct a real story this time.	3.0
...hokey art house pretension.	1.71428571429
Bennett's dramatization of her personal descent into post-breakup perdition has a morbid appeal that's tough to shake.	3.28571428571
A great comedy filmmaker knows great comedy needn't always make us laugh. Tim Story's not there yet - but 'Barbershop' shows he's on his way.	3.14285714286
It is risky, intelligent, romantic and rapturous from start to finish.	2.28571428571
The movie is our story as much as it is Schmidt's, no matter if it's viewed as a self-reflection or cautionary tale.	3.57142857143
A seriously bad film with seriously warped logic by writer-director Kurt Wimmer at the screenplay level.	3.0
This is NOT a retread of ``Dead Poets' Society.''	3.0
A memorable experience that, like many of his works, presents weighty issues colorfully wrapped up in his own idiosyncratic strain of kitschy goodwill.	3.0
One of the most incoherent features in recent memory.	1.57142857143
An ill-conceived jumble that's not scary, not smart and not engaging.	1.83333333333
Too lazy to take advantage of its semi-humorous premise.	1.83333333333
Ms. Seigner and Mr. Serrault bring fresh, unforced naturalism to their characters.	3.14285714286
The most memorable moment was when Green threw medical equipment at a window; not because it was particularly funny, but because I had a serious urge to grab the old lady at the end of my aisle's walker and toss it at the screen in frustration.	3.28571428571
Another entertaining romp from Robert Rodriguez.	3.28571428571
This 72-minute film does have some exciting scenes, but it's a tad slow.	2.66666666667
There are few things more frustrating to a film buff than seeing an otherwise good movie marred beyond redemption by a disastrous ending.	2.8
Astonishing...(frames) profound ethical and philosophical questions in the form of dazzling pop entertainment.	2.57142857143
An artsploitation movie with too much exploitation and too little art.	2.14285714286
A classy, sprightly spin on film.	1.28571428571
The film runs on a little longer than it needs to -- Muccino either doesn't notice when his story ends or just can't tear himself away from the characters -- but it's smooth and professional.	3.14285714286
If you're looking for something new and hoping for something entertaining, you're in luck.	1.57142857143
As happily glib and vicious as its characters.	1.66666666667
Schnitzler's film has a great hook, some clever bits and well-drawn, if standard issue, characters, but is still only partly satisfying.	3.33333333333
It is nature against progress. In Fessenden's horror trilogy, this theme has proved important to him and is especially so in the finale.	3.2
An extraordinary Swedish film about the soul adventure of marriage -- the kind of intimate and character-driven film that Bille August does best.	3.83333333333
A devastating indictment of unbridled greed and materalism.	2.14285714286
...a series of tales told with the intricate preciseness of the best short story writing.	2.16666666667
An interesting psychological game of cat-and-mouse, three-dimensional characters and believable performances all add up to a satisfying crime drama.	2.0
This slow-moving Swedish film offers not even a hint of joy, preferring to focus on the humiliation of Martin as he defecates in bed and urinates on the plants at his own birthday party.	3.8
Hard, endearing, caring, warm. Bring tissues.	1.57142857143
A delightful surprise because despite all the backstage drama, this is a movie that tells stories that work -- is charming, is moving, is funny and looks professional.	1.75
This overproduced and generally disappointing effort isn't likely to rouse the Rush Hour crowd.	2.71428571429
The movie would seem less of a trifle if Ms. Sugarman followed through on her defiance of the saccharine.	3.4
Once the 50 year old Benigni appears as the title character, we find ourselves longing for the block of wood to come back.	3.0
An odd drama set in the world of lingerie models and bar dancers in the Midwest that held my interest precisely because it didn't try to.	3.0
Two hours of melodramatic musical married to two hours of underdog sports intrigue, if the picture also shares the weaknesses of both genres, more's the pity.	2.5
The whole cast looks to be having so much fun with the slapstick antics and silly street patois, tossing around obscure expressions like Bellini and Mullinski, that the compact 86 minutes breezes by.	3.42857142857
Will amuse and provoke adventurous adults in specialty venues.	1.6
Could this be the first major studio production shot on video tape instead of film?	1.85714285714
Like a precious and finely cut diamond, magnificent to behold in its sparkling beauty yet in reality it's one tough rock.	2.42857142857
I cry for I Spy -- or I would if this latest and laziest imaginable of all vintage-TV spinoffs were capable of engendering an emotional response of any kind.	3.14285714286
To call The Other Side of Heaven ``appalling'' would be to underestimate just how dangerous entertainments like it can be.	3.0
Too stagey, talky -- and long -- for its own good.	1.66666666667
Underachieves only in not taking the Shakespeare parallels quite far enough.	2.57142857143
The corpse count ultimately overrides what little we learn along the way about vicarious redemption.	2.4
...is there a deeper, more direct connection between these women, one that spans time and reveals meaning? You bet there is and it's what makes this rather convoluted journey worth taking.	2.28571428571
It's better than The Phantom Menace. But unless you're an absolute raving Star Wars junkie, it isn't much fun.	3.0
On the Granger Movie Gauge of 1 to 10, The Powerpuff Girls is a fast, frenetic, funny, even punny 6 -- aimed specifically at a grade-school audience.	3.57142857143
Goyer's screenplay and direction are thankfully understated, and he has drawn excellent performances from his cast.	3.14285714286
Jones ... does offer a brutal form of charisma.	2.66666666667
It's pretty linear and only makeup-deep, but Bogdanovich ties it together with efficiency and an affection for the period.	3.16666666667
Visually fascinating ... an often intense character study about fathers and sons, loyalty and duty.	2.14285714286
A naturally funny film, Home Movie makes you crave Chris Smith's next movie.	3.57142857143
As a singular character study, it's perfect. It's also the year's sweetest movie.	2.33333333333
Hu and Liu offer natural, matter-of-fact performances that glint with sorrow, longing and love.	3.0
Like these Russo guys lookin' for their Mamet instead found their Sturges.	3.28571428571
A film that is a portrait of grace in an imperfect world.	1.66666666667
A baffling mixed platter of gritty realism and magic realism with a hard-to-swallow premise.	2.4
On this tricky topic, Tadpole is very much a step in the right direction, with its blend of frankness, civility and compassion.	3.42857142857
Richly entertaining and suggestive of any number of metaphorical readings.	2.28571428571
Just consider what New Best Friend does not have, beginning with the minor omission of a screenplay.	3.14285714286
Your appreciation of it will depend on what experiences you bring to it and what associations you choose to make.	1.83333333333
Making such a tragedy the backdrop to a love story risks trivializing it, though Chouraqui no doubt intended the film to affirm love's power to help people endure almost unimaginable horror.	3.83333333333
Bisset delivers a game performance, but she is unable to save the movie.	3.14285714286
Oddly, the film isn't nearly as downbeat as it sounds, but strikes a tone that's alternately melancholic, hopeful and strangely funny.	3.14285714286
The emotions are raw and will strike a nerve with anyone who's ever had family trauma.	2.8
Bad in such a bizarre way that it's almost worth seeing, if only to witness the crazy confluence of purpose and taste.	2.42857142857
Swimming is above all about a young woman's face, and by casting an actress whose face projects that woman's doubts and yearnings, it succeeds.	2.83333333333
Old people will love this movie, and I mean that in the nicest possible way: Last Orders will touch the heart of anyone old enough to have earned a 50-year friendship.	3.14285714286
You see Robert De Niro singing - and dancing to - West Side Story show tunes. Choose your reaction: A.) That sure is funny! B.) That sure is pathetic!	4.0
Care deftly captures the wonder and menace of growing up, but he never really embraces the joy of Fuhrman's destructive escapism or the grace-in-rebellion found by his characters.	3.33333333333
The long-range appeal of ``Minority Report'' should transcend any awards it bags. This is one for the ages.	4.0
Often messy and frustrating, but very pleasing at its best moments, it's very much like life itself.	1.875
A funny and well-contructed black comedy where the old adage ``be careful what you wish for'' is given a full workout.	2.57142857143
There is no pleasure in watching a child suffer. Just embarrassment and a vague sense of shame.	2.33333333333
The first Tunisian film I have ever seen, and it's also probably the most good-hearted yet sensual entertainment I'm likely to see all year.	2.5
The heart of the film is a touching reflection on aging, suffering and the prospect of death.	2.85714285714
may not have generated many sparks, but with his affection for Astoria and its people he has given his tale a warm glow.	3.28571428571
My precious new Star Wars movie is a lumbering, wheezy drag...	2.71428571429
