sentence	score
Goes a long way on hedonistic gusto.	1.66666666667
This is Carion's debut feature but his script and direction hums with a confidence that many spend entire careers trying to reach.	3.14285714286
What doesn't this film have that an impressionable kid couldn't stand to hear?	2.28571428571
Sensitive, insightful and beautifully rendered film. One of the best of the year.	1.71428571429
...gripping and handsome execution, (but) there isn't much about K-19 that's unique or memorable.	2.83333333333
A no-holds-barred cinematic treat.	1.0
The streets, shot by cinematographer Michael Ballhaus, may be as authentic as they are mean, but it is nearly impossible to care about what happens on them.	3.57142857143
Rarely, a movie is more than a movie. Go.	1.6
What the director can't do is make either of Val Kilmer's two personas interesting or worth caring about.	2.8
A knowing sense of humor and a lot of warmth ignite Son of the Bride.	3.6
If director Michael Dowse only superficially understands his characters, he doesn't hold them in contempt.	3.71428571429
Sayles ... once again strands his superb performers in the same old story.	2.0
Yet another movie which presumes that high school social groups are at war, let alone conscious of each other's existence.	2.0
Garca Bernal and Talancn are an immensely appealing couple, and even though their story is predictable, you'll want things to work out.	4.14285714286
The only thing worse than your substandard, run-of-the-mill Hollywood picture is an angst-ridden attempt to be profound.	2.71428571429
'Dragonfly' is a movie about a bus wreck that turns into a film wreck.	3.5
A solidly constructed, entertaining thriller that stops short of true inspiration.	2.0
An absorbing, slice-of-depression life that touches nerves and rings true.	1.66666666667
... while certainly clever in spots, this too-long, spoofy update of Shakespeare's Macbeth doesn't sustain a high enough level of invention.	2.71428571429
Daughter From Danang reveals that efforts toward closure only open new wounds. It doesn't flinch from its unsettling prognosis, namely, that the legacy of war is a kind of perpetual pain.	3.5
When it comes to the battle of Hollywood vs. Woo, it looks like Woo's a P.O.W.	3.0
an exceedingly clever piece of cinema.another great `what you don't see' is much more terrifying than what you do see thriller, coupled with some arresting effects, incandescent tones and stupendous performances	2.83333333333
Shyamalan offers copious hints along the way -- myriad signs, if you will -- that beneath the familiar, funny surface is a far bigger, far more meaningful story than one in which little green men come to Earth for harvesting purposes.	4.0
A strangely stirring experience that finds warmth in the coldest environment and makes each crumb of emotional comfort feel like a 10-course banquet.	2.42857142857
Dragonfly has no atmosphere, no tension -- nothing but Costner, flailing away. It's a buggy drag.	3.33333333333
As a kind of colorful, dramatized PBS program, Frida gets the job done. But, for that, why not watch a documentary?	3.0
Leguizamo and Jones are both excellent and the rest of the cast is uniformly superb.	3.42857142857
Gloriously straight from the vagina.	1.4
I'm sure mainstream audiences will be baffled, but, for those with at least a minimal appreciation of Woolf and Clarissa Dalloway, The Hours represents two of those well spent.	3.28571428571
Once (Kim) begins to overplay the shock tactics and bait-and-tackle metaphors, you may decide it's too high a price to pay for a shimmering picture postcard.	3.2
The humor is forced and heavy-handed, and occasionally simply unpleasant.	2.42857142857
If Ayurveda can help us return to a sane regimen of eating, sleeping and stress-reducing contemplation, it is clearly a good thing.	3.42857142857
This 90-minute postmodern voyage was more diverting and thought-provoking than I'd expected it to be.	2.33333333333
A marvel of production design.	1.25
Nicely serves as an examination of a society in transition.	2.0
It wouldn't be my preferred way of spending 100 minutes or $7.00.	1.8
Complex, sinuously plotted and, somehow, off-puttingly cold.	2.0
Got some good, organic character work, lots of obvious political insights and little room for engaging, imaginative filmmaking in its nearly 2 1/2-hour, dissipated length.	2.4
We want the funk - and this movie's got it.	1.57142857143
A reasonably entertaining sequel to 1994's surprise family hit that may strain adult credibility.	2.42857142857
The result is solemn and horrifying, yet strangely detached.	1.57142857143
A pretty funny movie, with most of the humor coming, as before, from the incongruous but chemically perfect teaming of Crystal and De Niro.	3.66666666667
Like watching a dress rehearsal the week before the show goes up: everything's in place but something's just a little off-kilter.	2.66666666667
The reason this picture works better than its predecessors is that Myers is no longer simply spoofing the mini-mod-madness of '60s spy movies.	3.14285714286
In execution, this clever idea is far less funny than the original, Killers From Space.	2.83333333333
A fitfully amusing romp that, if nothing else, will appeal to fans of Malcolm in the Middle and its pubescent star, Frankie Muniz.	3.83333333333
It's a glorified sitcom, and a long, unfunny one at that.	1.85714285714
Moore's complex and important film is also, believe it or not, immensely entertaining, a David and Goliath story that's still very much playing itself out.	3.66666666667
Now as a former Gong Show addict, I'll admit it, my only complaint is that we didn't get more re-creations of all those famous moments from the show.	3.0
``Austin Powers in Goldmember'' has the right stuff for silly summer entertainment and has enough laughs to sustain interest to the end.	3.66666666667
The all-French cast is marveilleux.	2.33333333333
Could I have been more geeked when I heard that Apollo 13 was going to be released in IMAX format? In a word: No.	3.16666666667
A TV style murder mystery with a few big screen moments (including one that seems to be made for a different film altogether).	2.6
Not quite as miraculous as its DreamWorks makers would have you believe, but it more than adequately fills the eyes and stirs the emotions.	2.75
Michael Moore has perfected the art of highly entertaining, self-aggrandizing, politically motivated documentary-making, and he's got as potent a topic as ever here.	3.71428571429
It's a familiar story, but one that is presented with great sympathy and intelligence.	2.14285714286
A superlative B movie -- funny, sexy, and rousing.	1.33333333333
An authentically vague, but ultimately purposeless, study in total pandemonium.	2.5
Another week, another gross-out college comedy--ugh.	2.42857142857
A penetrating glimpse into the tissue-thin ego of the stand-up comic.	2.16666666667
Sometimes we feel as if the film careens from one colorful event to another without respite, but sometimes it must have seemed to Frida Kahlo as if her life did, too.	3.57142857143
Insomnia is one of the year's best films and Pacino gives one of his most daring, and complicated, performances.	4.0
It's just plain lurid when it isn't downright silly.	1.83333333333
It's good, hard-edged stuff, violent and a bit exploitative but also nicely done, morally alert and street-smart.	2.0
The first half bursts with a goofy energy previous Disney films only used for a few minutes here and there.	2.66666666667
Somehow we're meant to buy that this doting mother would shun her kids, travel to one of the most dangerous parts of the world, don fatigues and become G.I. Jane.	3.28571428571
George Clooney proves he's quite a talented director and Sam Rockwell shows us he's a world-class actor with Confessions of a Dangerous Mind.	4.14285714286
An hour and a half of joyful solo performance.	1.85714285714
Bond-inspired? Certainly. Likely to have decades of life as a classic movie franchise? Let's hope not.	2.57142857143
It's both degrading and strangely liberating to see people working so hard at leading lives of sexy intrigue, only to be revealed by the dispassionate Gantz brothers as ordinary, pasty lumpen.	3.5
There is not a character in the movie with a shred of plausibility, not an event that is believable, not a confrontation that is not staged, not a moment that is not false.	2.5
There's no reason to miss Interview with the Assassin	3.0
Human Resources was a good, straightforward tale, but Time Out is better. It's haunting. It's like a poem.	3.33333333333
A subtle and well-crafted (for the most part) chiller.	1.6
A thoroughly entertaining comedy that uses Grant's own twist of acidity to prevent itself from succumbing to its own bathos.	3.0
A lot like the imaginary sport it projects onto the screen -- loud, violent and mindless.	2.0
Movie fans, get ready to take off...the other direction.	1.57142857143
Because Eight Legged Freaks is partly an homage to Them, Tarantula and other low- budget B-movie thrillers of the 1950s and '60s, the movie is a silly (but not sophomoric) romp through horror and hellish conditions.	4.42857142857
This wretchedly unfunny wannabe comedy is inane and awful - no doubt, it's the worst movie I've seen this summer.	1.8
Works as pretty contagious fun.	1.85714285714
Gives you the steady pulse of life in a beautiful city viewed through the eyes of a character who, in spite of tragic loss and increasing decrepitude, knows in his bones that he is one of the luckiest men alive.	2.6
As aimless as an old pickup skidding completely out of control on a long patch of black ice, the movie makes two hours feel like four.	2.0
Kim Ki-Deok seems to have in mind an (emotionally at least) adolescent audience demanding regular shocks and bouts of barely defensible sexual violence to keep it interested.	3.28571428571
Too much of the humor falls flat.	1.66666666667
You can watch, giggle and get an adrenaline boost without feeling like you've completely lowered your entertainment standards.	1.8
Being unique doesn't necessarily equate to being good, no matter how admirably the filmmakers have gone for broke.	2.0
A first-class road movie that proves you can run away from home, but your ego and all your problems go with you.	2.14285714286
An action/thriller of the finest kind, evoking memories of Day of the Jackal, The French Connection, and Heat.	3.28571428571
The script has less spice than a rat burger and The Rock's fighting skills are more in line with Steven Seagal.	3.16666666667
A coming-of-age film that avoids the cartoonish clichs and sneering humor of the genre as it provides a fresh view of an old type -- the uncertain girl on the brink of womanhood.	2.28571428571
A dashing and absorbing outing with one of France's most inventive directors.	2.71428571429
About nowhere kids who appropriated turfs as they found them and become self-made celebrity athletes -- a low-down version of the American dream.	2.57142857143
Never Again swings between false sentiment and unfunny madcap comedy and, along the way, expects the audience to invest in the central relationship as some kind of marriage of true minds.	3.83333333333
``Nicholas Nickleby'' is a perfect family film to take everyone to since there's no new ``A Christmas Carol'' out in the theaters this year. Charlie Hunnam has the twinkling eyes, repressed smile and determined face needed to carry out a Dickensian hero.	4.42857142857
Some actors steal scenes. Tom Green just gives them a bad odor. This self-infatuated goofball is far from the only thing wrong with the clumsy comedy Stealing Harvard, but he's the most obvious one.	4.14285714286
The magic (and original running time) of ace Japanimator Hayao Miyazaki's Spirited Away survives intact in BV's re-voiced version.	4.28571428571
Sushi for the connoisseurs of the macabre.	2.0
It's super- violent, super-serious and super-stupid.	1.83333333333
Schmaltzy and unfunny, Adam Sandler's cartoon about Hanukkah is numbingly bad, Little Nicky bad, 10 Worst List bad.	3.71428571429
This is wild surreal stuff, but brilliant and the camera just kind of sits there and lets you look at this and its like you're going from one room to the next and none of them have any relation to the other.	2.83333333333
Escaping the studio, Piccoli is warmly affecting and so is this adroitly minimalist movie.	3.0
If (Jaglom's) latest effort is not the director at his most sparkling, some of its repartee is still worth hearing.	3.2
One of recent memory's most thoughtful films about art, ethics, and the cost of moral compromise.	1.625
It's endlessly inventive, consistently intelligent and sickeningly savage.	1.28571428571
A lot of the credit for the film's winning tone must go to Grant, who hasn't lost a bit of the dry humor that first made audiences on both sides of the Atlantic love him.	3.28571428571
Draggin' about dragons	2.0
While I can't say it's on par with the first one, Stuart Little 2 is a light, fun cheese puff of a movie.	3.0
While the mystery surrounding the nature of the boat's malediction remains intriguing enough to sustain mild interest, the picture refuses to offer much accompanying sustenance in the way of characterization, humor or plain old popcorn fun.	2.8
The plot grows thin soon, and you find yourself praying for a quick resolution.	2.14285714286
Steven Soderbergh's digital video experiment is a clever and cutting, quick and dirty look at modern living and movie life.	3.16666666667
It's a fun adventure movie for kids (of all ages) that like adventure.	2.28571428571
What's really so appealing about the characters is their resemblance to everyday children.	2.16666666667
A whole lot foul, freaky and funny.	1.0
Everybody loves a David and Goliath story, and this one is told almost entirely from David's point of view.	3.0
Wonder of wonders -- a teen movie with a humanistic message.	2.42857142857
On the right track to something that's creepy and effective ... It's just going to take more than a man in a Bullwinkle costume to get there.	2.42857142857
Spinning a web of dazzling entertainment may be overstating it, but ``Spider-Man'' certainly delivers the goods.	3.5
An awfully good, achingly human picture.	1.71428571429
The fact that The Rookie is a nearly impeccable cinematic experience -- and a wonderful all-ages triumph besides -- is a miracle akin to the story the film portrays.	3.28571428571
Those moviegoers who would automatically bypass a hip-hop documentary should give ``Scratch'' a second look.	3.42857142857
A brain twister, less a movie-movie than a funny and weird meditation on Hollywood, success, artistic integrity and intellectual bankruptcy.	2.6
Few of the increasingly far-fetched events that first-time writer-director Neil Burger follows up with are terribly convincing, which is a pity, considering Barry's terrific performance.	3.42857142857
Led by Griffin's smartly nuanced performance and enthusiasm, the cast has a lot of fun with the material.	2.71428571429
(N)o matter how much good will the actors generate, Showtime eventually folds under its own thinness.	2.0
The charm of Revolution OS is rather the way it introduces you to new, fervently held ideas and fanciful thinkers.	3.28571428571
The director's twitchy sketchbook style and adroit perspective shifts grow wearisome amid leaden pacing and indifferent craftsmanship (most notably wretched sound design).	3.0
Poignant and delicately complex.	1.14285714286
A teasing drama whose relentless good-deed/bad-deed reversals are just interesting enough to make a sinner like me pray for an even more interesting, less symmetrical, less obviously cross-shaped creation.	2.42857142857
My oh my, is this an invigorating, electric movie.	1.5
Japanese director Shohei Imamura's latest film is an odd but ultimately satisfying blend of the sophomoric and the sublime.	3.14285714286
'You'll laugh for not quite and hour and a half, but come out feeling strangely unsatisfied. You'll feel like you ate a Reeses without the peanut butter...'	3.14285714286
Samira Makhmalbaf's new film Blackboards is much like the ethos of a stream of consciousness, although, it's unfortunate for the viewer that the thoughts and reflections coming through are torpid and banal	3.83333333333
Considering the harsh locations and demanding stunts, this must have been a difficult shoot, but the movie proves rough going for the audience as well.	2.28571428571
The tonal shifts are jolting, and though Wen's messages are profound and thoughtfully delivered, more thorough transitions would have made the film more cohesive.	3.42857142857
Not only a reminder of how they used to make movies, but also how they sometimes still can be made.	2.0
Dissing a Bond movie is quite like calling a dog stupid, but when it has the temerity to run over two hours, you feel like winding up with a kick.	3.6
The plot grinds on with yawn-provoking dullness.	2.0
The script is smart and dark - hallelujah for small favors.	1.625
The movie starts with a legend and ends with a story that is so far-fetched it would be impossible to believe if it weren't true. This is the stuff that Disney movies are made of.	2.57142857143
It's hard to imagine that even very small children will be impressed by this tired retread.	2.0
One Hour Photo is an intriguing snapshot of one man and his delusions; it's just too bad it doesn't have more flashes of insight.	2.85714285714
Elvira fans could hardly ask for more.	2.66666666667
Savvy director Robert J. Siegel and his co-writers keep the story subtle and us in suspense.	3.125
Mostly, (Goldbacher) just lets her complicated characters be unruly, confusing and, through it all, human.	3.33333333333
It has plenty of laughs. It just doesn't have much else... especially in a moral sense.	2.0
...a rich and intelligent film that uses its pulpy core conceit to probe questions of attraction and interdependence and how the heart accomodates practical needs. It is an unstinting look at a collaboration between damaged people that may or may not qual	3.0
You watch for that sense of openness, the little surprises.	1.85714285714
Sometimes smart but more often sophomoric.	1.85714285714
I don't think I laughed out loud once. And when you're talking about a slapstick comedy, that's a pretty big problem.	2.28571428571
Like a medium-grade network sitcom--mostly inoffensive, fitfully amusing, but ultimately so weightless that a decent draft in the auditorium might blow it off the screen.	2.5
The kids in the audience at the preview screening seemed bored, cheering the pratfalls but little else; their parents, wise folks that they are, read books.	1.6
It's like a ``Big Chill'' reunion of the Baader-Meinhof Gang, only these guys are more harmless pranksters than political activists.	3.5
Feels haphazard, as if the writers mistakenly thought they could achieve an air of frantic spontaneity by simply tossing in lots of characters doing silly stuff and stirring the pot.	2.42857142857
It's all pretty tame. The most offensive thing about the movie is that Hollywood expects people to pay to see it.	2.14285714286
Smart science fiction for grown-ups, with only a few false steps along the way.	2.14285714286
Although fairly involving as far as it goes, the film doesn't end up having much that is fresh to say about growing up Catholic or, really, anything.	2.57142857143
It may not be a huge cut of above the rest, but I enjoyed Barbershop. It's a funny little movie with clever dialogue and likeable characters.	4.2
``The Mothman Prophecies'' is a difficult film to shake from your conscience when night falls.	3.66666666667
Hatosy ... portrays young Brendan with his usual intelligence and subtlety, not to mention a convincing brogue.	2.85714285714
There's enough science to make it count as educational, and enough beauty to make it unforgettable.	2.4
When cowering and begging at the feet a scruffy Giannini, Madonna gives her best performance since Abel Ferrara had her beaten to a pulp in his Dangerous Game.	3.6
It's so full of wrong choices that all you can do is shake your head in disbelief -- and worry about what classic Oliver Parker intends to mangle next time.	2.85714285714
A dreadful live-action movie.	1.42857142857
This is not Chabrol's best, but even his lesser works outshine the best some directors can offer.	3.85714285714
The picture uses humor and a heartfelt conviction to tell a story about discovering your destination in life, but also acknowledging the places, and the people, from whence you came.	2.28571428571
Clayburgh and Tambor are charming performers; neither of them deserves Eric Schaeffer.	3.5
Bourne, Jason Bourne. He can scale a building like a super hero, he can out-stealth any agent, he'll get the girl. He's Super Spy!	4.0
It's not just the vampires that are damned in Queen of the Damned -- the viewers will feel they suffer the same fate.	3.4
The Master of Disguise is funny--not ``ha ha'' funny, ``dead circus performer'' funny. And for all the wrong reasons besides.	3.0
Like the original, this version is raised a few notches above kiddie fantasy pablum by Allen's astringent wit.	2.85714285714
A difficult but worthy film that bites off more than it can chew by linking the massacre of Armenians in 1915 with some difficult relationships in the present.	3.25
More maudlin than sharp.	1.57142857143
If the movie were all comedy, it might work better. But it has an ambition to say something about its subjects, but not a willingness.	2.14285714286
Rabbit-Proof Fence will probably make you angry. But it will just as likely make you weep, and it will do so in a way that doesn't make you feel like a sucker.	3.14285714286
The far future may be awesome to consider, but from period detail to matters of the heart, this film is most transporting when it stays put in the past.	2.6
Satisfyingly scarifying, fresh and old-fashioned at the same time.	2.125
Don't expect any surprises in this checklist of teamwork cliches...	2.0
In a way, the film feels like a breath of fresh air, but only to those that allow it in.	2.14285714286
The story drifts so inexorably into cliches about tortured (and torturing) artists and consuming but impossible love that you can't help but become more disappointed as each overwrought new sequence plods on.	3.28571428571
Intensely romantic, thought-provoking and even an engaging mystery.	1.875
It made me feel unclean, and I'm the guy who liked There's Something About Mary and both American Pie movies. Oh, and Booty Call.	3.16666666667
The movie weighs no more than a glass of flat champagne.	1.85714285714
It grabs you in the dark and shakes you vigorously for its duration.	1.83333333333
It's just weirdness for the sake of weirdness, and where Human Nature should be ingratiating, it's just grating.	2.4
Disturbing and brilliant documentary.	1.5
The movie is beautiful to behold and engages one in a sense of epic struggle -- inner and outer -- that's all too rare in Hollywood's hastier productions.	3.14285714286
It's all a rather shapeless good time...	1.33333333333
There's an energy to Y Tu Mam Tambin. Much of it comes from the brave, uninhibited performances by its lead actors.	3.42857142857
On the whole, the movie lacks wit, feeling and believability to compensate for its incessant coarseness and banality.	2.14285714286
It picked me up, swung me around, and dropped me back in my seat with more emotional force than any other recent film.	2.66666666667
Can be viewed as pure composition and form -- film as music	1.83333333333
Whatever one makes of its political edge, this is beautiful filmmaking from one of French cinema's master craftsmen.	2.83333333333
A vibrant, colorful, semimusical rendition.	1.75
The plot convolutions ultimately add up to nothing more than jerking the audience's chain.	1.83333333333
Watching E.T now, in an era dominated by cold, loud special-effects-laden extravaganzas, one is struck less by its lavish grandeur than by its intimacy and precision.	3.71428571429
A pro-fat farce that overcomes much of its excessive moral baggage thanks to two appealing lead performances.	2.14285714286
An ebullient Tunisian film about the startling transformation of a tradition-bound widow who is drawn into the exotic world of belly dancing.	3.71428571429
A candid and often fascinating documentary about a Pentecostal church in Dallas that assembles an elaborate haunted house each year to scare teenagers into attending services.	3.33333333333
Doesn't amount to much of anything.	1.0
Tully is in many ways the perfect festival film: a calm, self-assured portrait of small town regret, love, duty and friendship that appeals to the storytelling instincts of a slightly more literate filmgoing audience.	3.33333333333
The story is a rather simplistic one: grief drives her, love drives him, and a second chance to find love in the most unlikely place - it struck a chord in me.	2.14285714286
Lee's achievement extends to his supple understanding of the role that Brown played in American culture as an athlete, a movie star, and an image of black indomitability.	4.0
Transcends its agenda to deliver awe-inspiring, at times sublime, visuals and offer a fascinating glimpse into the subculture of extreme athletes whose derring-do puts the X into the games.	3.28571428571
A very witty take on change, risk and romance, and the film uses humour to make its points about acceptance and growth.	2.42857142857
The problem is not that it's all derivative, because plenty of funny movies recycle old tropes. The problem is that Van Wilder does little that is actually funny with the material.	3.14285714286
An inexperienced director, Mehta has much to learn.	2.71428571429
Plays like one of those conversations that Comic Book Guy on ``The Simpsons'' has.	3.0
We just don't really care too much about this love story. In that setting, their struggle is simply too ludicrous and borderline insulting.	2.5
